{
  "api": 1,
  "application": "arbejdstimer",
  "operator": "or",
  "holidays": [
    {
      "label": "public holiday",
      "at": [
        "2022-12-08"
      ]
    },
    {
      "label": "company holidays 2022/2023",
      "at": [
        "2022-12-23",
        "2023-01-02"
      ]
    },
    {
      "label": "company holidays 2023/2024",
      "at": [
        "2023-12-24",
        "2024-01-02"
      ]
    },
    {
      "label": "company holidays 2024/2025",
      "at": [
        "2024-12-24",
        "2025-01-02"
      ]
    },
    {
      "label": "company holidays 2025/2026",
      "at": [
        "2025-12-20",
        "2026-01-05"
      ]
    }
  ],
  "working_hours": [8, 17]
}
